Rosemary Ranch Chicken Kabobs,https://www.allrecipes.com/recipe/64513/rosemary-ranch-chicken-kabobs/,"½ cup olive oil, ½ cup ranch dressing, 3 tablespoons Worcestershire sauce, 1 tablespoon minced fresh rosemary, 2 teaspoons salt, 1 teaspoon lemon juice, 1 teaspoon white vinegar, ¼ teaspoon ground black pepper; or to taste, 1 tablespoon white sugar; or to taste (optional), 5 skinless; boneless chicken breast halves - cut into 1 inch cubes"
Buffalo Chicken Dip,https://www.allrecipes.com/recipe/68461/buffalo-chicken-dip/,"2 (10 ounce) cans chunk chicken; drained, 2 (8 ounce) packages cream cheese; softened, 1 cup Ranch dressing, ¾ cup pepper sauce (such as Frank's Red Hot®), 1 ½ cups shredded Cheddar cheese, 1 bunch celery; cleaned and cut into 4 inch pieces, 1 (8 ounce) box chicken-flavored crackers"
Ultimate Twice Baked Potatoes,https://www.allrecipes.com/recipe/24332/ultimate-twice-baked-potatoes/,"4 large baking potatoes, 8 slices bacon, 1 cup sour cream, 1/2 cup milk, 4 tablespoons butter, 1/2 teaspoon salt, 1/2 teaspoon pepper, 1 cup shredded Cheddar cheese; divided, 8 green onions; sliced; divided"
Japanese-Style Deep-Fried Shrimp,https://www.allrecipes.com/recipe/127500/japanese-style-deep-fried-shrimp/,"1 pound medium shrimp; peeled (tails left on) and deveined, 1/2 teaspoon salt, 1/2 teaspoon ground black pepper, 1/2 teaspoon garlic powder, 1 cup all-purpose flour, 1 teaspoon paprika, 2 eggs; beaten, 1 cup panko crumbs, 1 quart vegetable oil for frying"
Baked Ziti I,https://www.allrecipes.com/recipe/11758/baked-ziti-i/,"1 pound dry ziti pasta, 1 onion; chopped, 1 pound lean ground beef, 2 (26 ounce) jars spaghetti sauce, 6 ounces provolone cheese; sliced, 1 1/2 cups sour cream, 6 ounces mozzarella cheese; shredded, 2 tablespoons grated Parmesan cheese"
Greek Lemon Chicken and Potatoes,https://www.allrecipes.com/recipe/242352/greek-lemon-chicken-and-potatoes/,"4 pounds skin-on; bone-in chicken thighs, 1 tablespoon kosher salt, 1 tablespoon dried oregano, 1 teaspoon freshly ground black pepper, 1 teaspoon dried rosemary, 1 pinch cayenne pepper, ½ cup fresh lemon juice, ½ cup olive oil, 6 cloves garlic; minced, 3 russet potatoes; peeled and quartered, ⅔ cup chicken broth; plus splash to deglaze pan, chopped fresh oregano for garnish"
Veracruz-Style Red Snapper,https://www.allrecipes.com/recipe/228046/veracruz-style-red-snapper/,"2 tablespoons olive oil, 1/2 white onion; diced, 3 cloves garlic; minced, 1 tablespoon capers, 1 tablespoon caper juice, 1 cup cherry tomatoes; halved, 1/3 cup pitted; sliced green olives (such as Castelvetrano), 1 jalapeno pepper; seeded and chopped, 2 teaspoons chopped fresh oregano, 2 teaspoons olive oil, 2 (7 ounce) red snapper fillets; cut in half, salt and pepper to taste, 1/2 teaspoon cayenne pepper; or more to taste, 2 limes; juiced"
Carrot Cake III,https://www.allrecipes.com/recipe/7402/carrot-cake-iii/,"4 eggs, 1 ¼ cups vegetable oil, 2 cups white sugar, 2 teaspoons vanilla extract, 2 cups all-purpose flour, 2 teaspoons baking soda, 2 teaspoons baking powder, ½ teaspoon salt, 2 teaspoons ground cinnamon, 3 cups grated carrots, 1 cup chopped pecans, ½ cup butter; softened, 8 ounces cream cheese; softened, 4 cups confectioners' sugar, 1 teaspoon vanilla extract, 1 cup chopped pecans"
Indian Chicken Curry (Murgh Kari),https://www.allrecipes.com/recipe/212721/indian-chicken-curry-murgh-kari/,"2 pounds skinless; boneless chicken breast halves, 2 teaspoons salt, ½ cup cooking oil, 1 ½ cups chopped onion, 1 tablespoon minced garlic, 1 ½ teaspoons minced fresh ginger root, 1 tablespoon curry powder, 1 teaspoon ground cumin, 1 teaspoon ground turmeric, 1 teaspoon ground coriander, 1 teaspoon cayenne pepper, 1 tablespoon water, 1 (15 ounce) can crushed tomatoes, 1 cup plain yogurt, 1 tablespoon chopped fresh cilantro, 1 teaspoon salt, ½ cup water, 1 teaspoon garam masala, 1 tablespoon chopped fresh cilantro, 1 tablespoon fresh lemon juice"
Bread Pudding II,https://www.allrecipes.com/recipe/7177/bread-pudding-ii/,"6 slices day-old bread, 2 tablespoons butter; melted, 1/2 cup raisins (optional), 4 eggs; beaten, 2 cups milk, 3/4 cup white sugar, 1 teaspoon ground cinnamon, 1 teaspoon vanilla extract"
Chocolate Zucchini Bread I,https://www.allrecipes.com/recipe/17289/chocolate-zucchini-bread-i/,"2 (1 ounce) squares unsweetened chocolate, 3 eggs, 2 cups white sugar, 1 cup vegetable oil, 2 cups grated zucchini, 1 teaspoon vanilla extract, 2 cups all-purpose flour, 1 teaspoon baking soda, 1 teaspoon salt, 1 teaspoon ground cinnamon, 3/4 cup semisweet chocolate chips"
Chicken Tortilla Soup V,https://www.allrecipes.com/recipe/15840/chicken-tortilla-soup-v/,"2 skinless; boneless chicken breasts; cut into cubes, ½ teaspoon olive oil, ½ teaspoon minced garlic, ¼ teaspoon ground cumin, 2 (14.5 ounce) cans chicken broth, 1 cup frozen corn kernels, 1 cup chopped onion, ½ teaspoon chili powder, 1 tablespoon lemon juice, 1 cup chunky salsa, 8 ounces corn tortilla chips, ½ cup shredded Monterey Jack cheese (optional)"
Fish Tacos,https://www.allrecipes.com/recipe/53729/fish-tacos/,"1 cup all-purpose flour, 2 tablespoons cornstarch, 1 teaspoon baking powder, 1/2 teaspoon salt, 1 egg, 1 cup beer, 1/2 cup plain yogurt, 1/2 cup mayonnaise, 1 lime; juiced, 1 jalapeno pepper; minced, 1 teaspoon minced capers, 1/2 teaspoon dried oregano, 1/2 teaspoon ground cumin, 1/2 teaspoon dried dill weed, 1 teaspoon ground cayenne pepper, 1 quart oil for frying, 1 pound cod fillets; cut into 2 to 3 ounce portions, 1 (12 ounce) package corn tortillas, 1/2 medium head cabbage; finely shredded"
Red Skinned Potato Salad,https://www.allrecipes.com/recipe/25155/red-skinned-potato-salad/,"2 pounds clean; scrubbed new red potatoes, 6 eggs, 1 pound bacon, 1 onion; finely chopped, 1 stalk celery; finely chopped, 2 cups mayonnaise, salt and pepper to taste"
Chocolate Cappuccino Cheesecake,https://www.allrecipes.com/recipe/7384/chocolate-cappuccino-cheesecake/,"1 cup chocolate cookie crumbs, ¼ cup butter; softened, 2 tablespoons white sugar, ¼ teaspoon ground cinnamon, 3 (8 ounce) packages cream cheese; softened, 1 cup white sugar, 3 eggs, 8 (1 ounce) squares semisweet chocolate, 2 tablespoons whipping cream, 1 cup sour cream, ¼ teaspoon salt, 2 teaspoons instant coffee granules dissolved in 1/4 cup hot water, ¼ cup coffee flavored liqueur, 2 teaspoons vanilla extract, 1 cup heavy whipping cream, 2 tablespoons confectioners' sugar, 2 tablespoons coffee-flavored liqueur, 1 (1 ounce) square semisweet chocolate"
Paul's Pumpkin Bars,https://www.allrecipes.com/recipe/11646/pauls-pumpkin-bars/,"4 eggs, 1 ⅔ cups white sugar, 1 cup vegetable oil, 1 (15 ounce) can pumpkin puree, 2 cups all-purpose flour, 2 teaspoons baking powder, 1 teaspoon baking soda, 2 teaspoons ground cinnamon, 1 teaspoon salt, 1 (3 ounce) package cream cheese; softened, ½ cup butter; softened, 1 teaspoon vanilla extract, 2 cups sifted confectioners' sugar"
Grilled Tilapia with Mango Salsa,https://www.allrecipes.com/recipe/166771/grilled-tilapia-with-mango-salsa/,"1/3 cup extra-virgin olive oil, 1 tablespoon lemon juice, 1 tablespoon minced fresh parsley, 1 clove garlic; minced, 1 teaspoon dried basil, 1 teaspoon ground black pepper, 1/2 teaspoon salt, 2 (6 ounce) tilapia fillets, 1 large ripe mango; peeled; pitted and diced, 1/2 red bell pepper; diced, 2 tablespoons minced red onion, 1 tablespoon chopped fresh cilantro, 1 jalapeno pepper; seeded and minced, 2 tablespoons lime juice, 1 tablespoon lemon juice, salt and pepper to taste"
Eclair Cake,https://www.allrecipes.com/recipe/7304/eclair-cake/,"2 (3.5 ounce) packages instant vanilla pudding mix, 1 (8 ounce) container frozen whipped topping; thawed, 3 cups milk, 1 (16 ounce) package graham cracker squares, 1 (16 ounce) package prepared chocolate frosting"
Chef John's Baked Mushroom Risotto,https://www.allrecipes.com/recipe/231713/chef-johns-baked-mushroom-risotto/,"3 tablespoons butter, 3 cups diced mushrooms, salt to taste, 1/2 yellow onion; diced, ground black pepper to taste, 1 pinch cayenne pepper, 1 cup carnaroli rice, 2 cups chicken broth; divided, 1/2 cup heavy whipping cream, 1/2 cup chicken broth, 2 tablespoons heavy whipping cream, 1/2 cup finely grated Parmigiano-Reggiano cheese, 2 tablespoons chopped fresh chives"
Texas Caviar I,https://www.allrecipes.com/recipe/24720/texas-caviar-i/,"1/2 onion; chopped, 1 green bell pepper; chopped, 1 bunch green onions; chopped, 2 jalapeno peppers; chopped, 1 tablespoon minced garlic, 1 pint cherry tomatoes; quartered, 1 (8 ounce) bottle zesty Italian dressing, 1 (15 ounce) can black beans; drained, 1 (15 ounce) can black-eyed peas; drained, 1/2 teaspoon ground coriander, 1 bunch chopped fresh cilantro"
Chocolate Trifle,https://www.allrecipes.com/recipe/19017/chocolate-trifle/,"1 (19.8 ounce) package brownie mix, 1 (3.9 ounce) package instant chocolate pudding mix, 1/2 cup water, 1 (14 ounce) can sweetened condensed milk, 1 (8 ounce) container frozen whipped topping; thawed, 1 (12 ounce) container frozen whipped topping; thawed, 1 (1.5 ounce) bar chocolate candy"
Whipped Cream Cream Cheese Frosting,https://www.allrecipes.com/recipe/19108/whipped-cream-cream-cheese-frosting/,"1 (8 ounce) package cream cheese, 1 cup white sugar, 1/8 teaspoon salt, 1 teaspoon vanilla extract, 1 1/2 cups heavy whipping cream"
"Curried Cashew, Pear, and Grape Salad",https://www.allrecipes.com/recipe/81565/curried-cashew-pear-and-grape-salad/,"¾ cup cashew halves, 4 slices bacon; coarsely chopped, 1 tablespoon melted butter, 1 teaspoon chopped fresh rosemary, 1 teaspoon curry powder, 1 tablespoon brown sugar, ½ teaspoon kosher salt, ½ teaspoon cayenne pepper, 3 tablespoons white wine vinegar, 3 tablespoons Dijon mustard, 2 tablespoons honey, ½ cup olive oil, salt and black pepper to taste, 1 (10 ounce) package mixed salad greens, ½ medium Bosc pear; thinly sliced, ½ cup halved seedless red grapes"
Mom's Best Peanut Brittle,https://www.allrecipes.com/recipe/15987/moms-best-peanut-brittle/,"1 cup white sugar, 1/2 cup light corn syrup, 1/4 teaspoon salt, 1/4 cup water, 1 cup peanuts, 2 tablespoons butter; softened, 1 teaspoon baking soda"
Clark's Quiche,https://www.allrecipes.com/recipe/50523/clarks-quiche/,"½ pound thick sliced bacon, 1 (10 ounce) package frozen chopped spinach; thawed, 1 (8 ounce) container sour cream, salt and pepper to taste, 2 (9 inch) unbaked pie crusts, 2 tablespoons olive oil, 1 onion; finely diced, ½ pound fresh mushrooms; finely diced, 2 cups finely diced smoked ham, 8 ounces Monterey Jack cheese; shredded, 8 ounces Cheddar cheese; shredded, 4 ounces Parmesan cheese; grated, 8 eggs, 1 ½ cups half-and-half cream, 1 tablespoon dried parsley, salt and pepper to taste"
Blackberry Cobbler II,https://www.allrecipes.com/recipe/65155/blackberry-cobbler-ii/,"1 cup all-purpose flour, 1 1/2 cups white sugar; divided, 1 teaspoon baking powder, 1/2 teaspoon salt, 6 tablespoons cold butter, 1/4 cup boiling water, 2 tablespoons cornstarch, 1/4 cup cold water, 1 tablespoon lemon juice, 4 cups fresh blackberries; rinsed and drained"
Crawfish Chowder,https://www.allrecipes.com/recipe/23572/crawfish-chowder/,"1/4 cup butter, 1/2 bunch green onions; chopped, 1/2 cup butter, 2 pounds frozen crawfish; cleaned, 2 (10.75 ounce) cans condensed cream of potato soup, 1 (10.75 ounce) can condensed cream of mushroom soup, 1 (15.25 ounce) can whole kernel corn; drained, 4 ounces cream cheese; softened, 2 cups half-and-half cream, 1/2 teaspoon cayenne pepper"
Slow Cooker Beef Pot Roast,https://www.allrecipes.com/recipe/220125/slow-cooker-beef-pot-roast/,"1 (5 pound) bone-in beef pot roast, salt and pepper to taste, 1 tablespoon all-purpose flour; or as needed, 2 tablespoons vegetable oil, 8 ounces sliced mushrooms, 1 medium onion; chopped, 2 cloves garlic; minced, 1 tablespoon butter, 1 1/2 tablespoons all-purpose flour, 1 tablespoon tomato paste, 2 1/2 cups chicken broth, 3 medium carrots; cut into chunks, 2 stalks celery; cut into chunks, 1 sprig fresh rosemary, 2 sprigs fresh thyme"
Apple Crisp II,https://www.allrecipes.com/recipe/12409/apple-crisp-ii/,"10 cups all-purpose apples; peeled; cored and sliced, 1 cup white sugar, 1 tablespoon all-purpose flour, 1 teaspoon ground cinnamon, 1/2 cup water, 1 cup quick-cooking oats, 1 cup all-purpose flour, 1 cup packed brown sugar, 1/4 teaspoon baking powder, 1/4 teaspoon baking soda, 1/2 cup butter; melted"
"Sweet Potato, Carrot, Apple, and Red Lentil Soup",https://www.allrecipes.com/recipe/186378/sweet-potato-carrot-apple-and-red-lentil-soup/,"1/4 cup butter, 2 large sweet potatoes; peeled and chopped, 3 large carrots; peeled and chopped, 1 apple; peeled; cored and chopped, 1 onion; chopped, 1/2 cup red lentils, 1/2 teaspoon minced fresh ginger, 1/2 teaspoon ground black pepper, 1 teaspoon salt, 1/2 teaspoon ground cumin, 1/2 teaspoon chili powder, 1/2 teaspoon paprika, 4 cups vegetable broth, plain yogurt"
Outrageous Chocolate Chip Cookies,https://www.allrecipes.com/recipe/10141/outrageous-chocolate-chip-cookies/,"½ cup butter, ½ cup white sugar, ⅓ cup packed brown sugar, ½ cup peanut butter, ½ teaspoon vanilla extract, 1 egg, 1 cup all-purpose flour, 1 teaspoon baking soda, ¼ teaspoon salt, ½ cup rolled oats, 1 cup semisweet chocolate chips"
All-Day Apple Butter,https://www.allrecipes.com/recipe/21205/all-day-apple-butter/,"5 1/2 pounds apples - peeled; cored and finely chopped, 4 cups white sugar, 2 teaspoons ground cinnamon, 1/4 teaspoon ground cloves, 1/4 teaspoon salt"
Chocolate Chip Cookie Ice Cream Cake,https://www.allrecipes.com/recipe/19005/chocolate-chip-cookie-ice-cream-cake/,"1 (18 ounce) package small chocolate chip cookies, 1/4 cup margarine; melted, 1 cup hot fudge topping, 2 quarts vanilla ice cream, 1 cup whipped cream, 12 cherries"
Quick and Easy Pizza Crust,https://www.allrecipes.com/recipe/20171/quick-and-easy-pizza-crust/,"1 (.25 ounce) package active dry yeast, 1 teaspoon white sugar, 1 cup warm water (110 degrees F/45 degrees C), 2 1/2 cups bread flour, 2 tablespoons olive oil, 1 teaspoon salt"
Chicken Noodle Soup,https://www.allrecipes.com/recipe/8562/chicken-noodle-soup/,"4 cups chopped; cooked chicken meat, 1 cup chopped celery, ¼ cup chopped carrots, ¼ cup chopped onion, ¼ cup butter, 8 ounces egg noodles, 12 cups water, 9 cubes chicken bouillon, ½ teaspoon dried marjoram, ½ teaspoon ground black pepper, 1 bay leaf, 1 tablespoon dried parsley"
Maple-Brined Pork Loin,https://www.allrecipes.com/recipe/220989/maple-brined-pork-loin/,"1 quart cold water, 1/4 cup salt, 1/3 cup maple syrup, 3 cloves garlic; crushed, 3 tablespoons chopped fresh ginger, 2 teaspoons dried rosemary, 1 tablespoon cracked black pepper, 1/2 teaspoon red pepper flakes, 1 (2 1/2 pound) boneless pork loin roast, salt and freshly ground black pepper, 1 tablespoon vegetable oil, 2 tablespoons maple syrup, 2 tablespoons Dijon mustard"
Slow Cooker Baby Back Ribs,https://www.allrecipes.com/recipe/228498/slow-cooker-baby-back-ribs/,"3 pounds baby back ribs; trimmed, salt and ground black pepper; to taste, ½ cup water, ½ onion; sliced, 1 clove garlic; minced, 1 (18 ounce) bottle barbeque sauce"
Simple Syrup,https://www.allrecipes.com/recipe/20216/simple-syrup/,"1 cup white sugar, 1 cup water"
Naan,https://www.allrecipes.com/recipe/14565/naan/,"1 (.25 ounce) package active dry yeast, 1 cup warm water, 1/4 cup white sugar, 3 tablespoons milk, 1 egg; beaten, 2 teaspoons salt, 4 1/2 cups bread flour, 2 teaspoons minced garlic (optional), 1/4 cup butter; melted"
Best Damn Chili,https://www.allrecipes.com/recipe/233613/best-damn-chili/,"4 tablespoons olive oil, 1 yellow onion; chopped, 1 red bell pepper; chopped, 1 Anaheim chile pepper; chopped, 2 red jalapeno pepper; chopped, 4 garlic cloves; minced, 2 1/2 pounds lean ground beef, 1/4 cup Worcestershire sauce, 1 pinch garlic powder; or to taste, 2 beef bouillon cubes, 1 (12 fluid ounce) can or bottle light beer (such as Coors®), 1 (28 ounce) can crushed San Marzano tomatoes, 1 (14.5 ounce) can fire-roasted diced tomatoes, 1 (12 ounce) can tomato paste, 1/2 cup white wine, 2 tablespoons chili powder, 2 tablespoons ground cumin, 1 tablespoon brown sugar, 1 tablespoon chipotle pepper sauce, 2 1/2 teaspoons dried basil, 1 1/2 teaspoons smoked paprika, 1 teaspoon salt, 1/2 teaspoon dried oregano, 1/2 teaspoon ground black pepper, 2 (16 ounce) cans dark red kidney beans (such as Bush's®), 1 cup sour cream, 3 tablespoons chopped fresh cilantro, 1/2 teaspoon ground cumin"
Apple Pie Muffins,https://www.allrecipes.com/recipe/111924/apple-pie-muffins/,"2 1/4 cups all-purpose flour, 1 teaspoon baking soda, 1/2 teaspoon salt, 1 egg, 1 cup buttermilk, 1/2 cup butter; melted, 1 teaspoon vanilla extract, 1 1/2 cups packed brown sugar, 2 cups diced apples, 1/2 cup packed brown sugar, 1/3 cup all-purpose flour, 1 teaspoon ground cinnamon, 2 tablespoons butter; melted"
Pecan Pie V,https://www.allrecipes.com/recipe/22544/pecan-pie-v/,"1 cup light brown sugar, ¼ cup white sugar, ½ cup butter, 2 eggs, 1 tablespoon all-purpose flour, 1 tablespoon milk, 1 teaspoon vanilla extract, 1 cup chopped pecans"
"Kale, Quinoa, and Avocado Salad with Lemon Dijon Vinaigrette",https://www.allrecipes.com/recipe/230050/kale-quinoa-and-avocado-salad-with-lemon-dijon-vinaigrette/,"Salad, 2/3 cup quinoa, 1 1/3 cups water, 1 bunch kale; torn into bite-sized pieces, 1/2 avocado - peeled; pitted; and diced, 1/2 cup chopped cucumber, 1/3 cup chopped red bell pepper, 2 tablespoons chopped red onion, 1 tablespoon crumbled feta cheese, Dressing, 1/4 cup olive oil, 2 tablespoons lemon juice, 1 1/2 tablespoons Dijon mustard, 3/4 teaspoon sea salt, 1/4 teaspoon ground black pepper"
Cream of Fresh Asparagus Soup II,https://www.allrecipes.com/recipe/13114/cream-of-fresh-asparagus-soup-ii/,"1 pound fresh asparagus; trimmed and cut into 1 inch pieces, 1/2 cup chopped onion, 1 (14.5 ounce) can chicken broth, 2 tablespoons butter, 2 tablespoons all-purpose flour, 1 teaspoon salt, 1 pinch ground black pepper, 1 cup milk, 1/2 cup sour cream, 1 teaspoon fresh lemon juice"
Firecracker Grilled Alaska Salmon,https://www.allrecipes.com/recipe/16699/firecracker-grilled-alaska-salmon/,"8 (4 ounce) fillets salmon, 1/2 cup peanut oil, 4 tablespoons soy sauce, 4 tablespoons balsamic vinegar, 4 tablespoons green onions; chopped, 3 teaspoons brown sugar, 2 cloves garlic; minced, 1 1/2 teaspoons ground ginger, 2 teaspoons crushed red pepper flakes, 1 teaspoon sesame oil, 1/2 teaspoon salt"
Jay's Signature Pizza Crust,https://www.allrecipes.com/recipe/7245/jays-signature-pizza-crust/,"2 1/4 teaspoons active dry yeast, 1/2 teaspoon brown sugar, 1 1/2 cups warm water (110 degrees F/45 degrees C), 1 teaspoon salt, 2 tablespoons olive oil, 3 1/3 cups all-purpose flour"
Spinach Quiche,https://www.allrecipes.com/recipe/16664/spinach-quiche/,"1/2 cup butter, 3 cloves garlic; chopped, 1 small onion; chopped, 1 (10 ounce) package frozen chopped spinach; thawed and drained, 1 (4.5 ounce) can mushrooms; drained, 1 (6 ounce) package herb and garlic feta; crumbled, 1 (8 ounce) package shredded Cheddar cheese, salt and pepper to taste, 1 (9 inch) unbaked deep dish pie crust, 4 eggs; beaten, 1 cup milk, salt and pepper to taste"
Bread and Butter Pickles II,https://www.allrecipes.com/recipe/21166/bread-and-butter-pickles-ii/,"25 cucumbers; thinly sliced, 6 onions; thinly sliced, 2 green bell peppers; diced, 3 cloves garlic; chopped, 1/2 cup salt, 3 cups cider vinegar, 5 cups white sugar, 2 tablespoons mustard seed, 1 1/2 teaspoons celery seed, 1/2 teaspoon whole cloves, 1 tablespoon ground turmeric"
Easy Indian Butter Chicken,https://www.allrecipes.com/recipe/141169/easy-indian-butter-chicken/,"1 cup butter; divided, 1 onion; minced, 1 tablespoon minced garlic, 1 (15 ounce) can tomato sauce, 3 cups heavy cream, 2 teaspoons salt, 1 teaspoon cayenne pepper, 1 teaspoon garam masala, 1 ½ pounds skinless; boneless chicken breast; cut into bite-sized chunks, 2 tablespoons vegetable oil, 2 tablespoons tandoori masala"
Chef John's Chicken Tikka Masala,https://www.allrecipes.com/recipe/239867/chef-johns-chicken-tikka-masala/,"1 ½ pounds skinless; boneless chicken thighs, 1 tablespoon vegetable oil, 2 teaspoons kosher salt, 2 teaspoons garam masala, 2 teaspoons ground cumin, 1 teaspoon ground coriander, 1 teaspoon smoked paprika, 1 teaspoon ground turmeric, ½ teaspoon ground black pepper, ¼ teaspoon cayenne pepper, ⅛ teaspoon ground cardamom, 2 tablespoons clarified butter (ghee); or more as needed, 1 onion; chopped, ¼ cup tomato paste, 4 cloves garlic; finely grated, 1 tablespoon finely grated ginger; or more to taste, 1 cup crushed tomatoes, 1 (13 ounce) can coconut milk, ½ cup chicken broth; or as needed, 2 tablespoons chopped fresh cilantro, ½ teaspoon red pepper flakes, salt and ground black pepper to taste"
The Best Vegetarian Chili in the World,https://www.allrecipes.com/recipe/72508/the-best-vegetarian-chili-in-the-world/,"1 tablespoon olive oil, 1/2 medium onion; chopped, 2 bay leaves, 1 teaspoon ground cumin, 2 tablespoons dried oregano, 1 tablespoon salt, 2 stalks celery; chopped, 2 green bell peppers; chopped, 2 jalapeno peppers; chopped, 3 cloves garlic; chopped, 2 (4 ounce) cans chopped green chile peppers; drained, 2 (12 ounce) packages vegetarian burger crumbles, 3 (28 ounce) cans whole peeled tomatoes; crushed, 1/4 cup chili powder, 1 tablespoon ground black pepper, 1 (15 ounce) can kidney beans; drained, 1 (15 ounce) can garbanzo beans; drained, 1 (15 ounce) can black beans, 1 (15 ounce) can whole kernel corn"
Grilled Bacon Jalapeno Wraps,https://www.allrecipes.com/recipe/87076/grilled-bacon-jalapeno-wraps/,"6 fresh jalapeno peppers; halved lengthwise and seeded, 1 (8 ounce) package cream cheese, 12 slices bacon"
Amazingly Good Eggnog,https://www.allrecipes.com/recipe/57028/amazingly-good-eggnog/,"4 cups milk, 5 whole cloves, 1/2 teaspoon vanilla extract, 1 teaspoon ground cinnamon, 12 egg yolks, 1 1/2 cups sugar, 2 1/2 cups light rum, 4 cups light cream, 2 teaspoons vanilla extract, 1/2 teaspoon ground nutmeg"
Simple Roasted Butternut Squash,https://www.allrecipes.com/recipe/229733/simple-roasted-butternut-squash/,"1 butternut squash - peeled; seeded; and cut into 1-inch cubes, 2 tablespoons olive oil, 2 cloves garlic; minced, salt and ground black pepper to taste"
"Bow Ties with Sausage, Tomatoes and Cream",https://www.allrecipes.com/recipe/26257/bow-ties-with-sausage-tomatoes-and-cream/,"1 (12 ounce) package bow tie pasta, 2 tablespoons olive oil, 1 pound sweet Italian sausage; casings removed and crumbled, 1/2 teaspoon red pepper flakes, 1/2 cup diced onion, 3 cloves garlic; minced, 1 (28 ounce) can Italian-style plum tomatoes; drained and coarsely chopped, 1 1/2 cups heavy cream, 1/2 teaspoon salt, 3 tablespoons minced fresh parsley"
Texas Sheet Cake V,https://www.allrecipes.com/recipe/23056/texas-sheet-cake-v/,"2 cups all-purpose flour, 2 cups white sugar, 1 teaspoon baking soda, ½ teaspoon salt, ½ cup sour cream, 2 eggs, 1 cup butter, 1 cup water, 5 tablespoons unsweetened cocoa powder, 6 tablespoons milk, 5 tablespoons unsweetened cocoa powder, ½ cup butter, 4 cups confectioners' sugar, 1 teaspoon vanilla extract, 1 cup chopped walnuts (optional)"
Grill Master Chicken Wings,https://www.allrecipes.com/recipe/213068/grill-master-chicken-wings/,"½ cup soy sauce, ½ cup Italian-style salad dressing, 3 pounds chicken wings; cut apart at joints; wing tips discarded, ¼ cup butter, 1 teaspoon soy sauce, ¼ cup hot pepper sauce (such as Frank's RedHot®); or to taste"
Chocolate Eclair Dessert,https://www.allrecipes.com/recipe/19009/chocolate-eclair-dessert/,"2 individual packages graham crackers, 2 (3 ounce) packages instant vanilla pudding mix, 3 cups milk, 1 (8 ounce) container frozen whipped topping; thawed, 1 (16 ounce) package prepared chocolate frosting"
Puppy Chow I,https://www.allrecipes.com/recipe/11229/puppy-chow-i/,"1/2 cup butter, 1 cup creamy peanut butter, 2 cups milk chocolate chips, 1 (17.5 ounce) package crispy corn and rice cereal, 1 pound confectioners' sugar"
Microwave Lemon Curd,https://www.allrecipes.com/recipe/70036/microwave-lemon-curd/,"1 cup white sugar, 3 eggs, 1 cup fresh lemon juice, 3 lemons; zested, 1/2 cup unsalted butter; melted"
Chef John's Honey-Glazed Ham,https://www.allrecipes.com/recipe/240752/chef-johns-honey-glazed-ham/,"3/4 cup water; or as needed, 2 whole star anise, 12 whole cloves; or more to taste, 1 (7 pound) country-style ham, 1 cup firmly packed light brown sugar, 1/4 cup honey, 2 tablespoons Dijon mustard, 2 tablespoons rice vinegar, 1 1/2 teaspoons freshly ground black pepper, 1/2 teaspoon Worcestershire sauce, 1 pinch cayenne pepper"
Outrageous Warm Chicken Nacho Dip,https://www.allrecipes.com/recipe/157940/outrageous-warm-chicken-nacho-dip/,"1 (14 ounce) can diced tomatoes with green chile peppers (such as RO*TEL®); drained, 1 (1 pound) loaf processed cheese food (such as Velveeta®); cubed, 2 large cooked skinless; boneless chicken breast halves; shredded, ⅓ cup sour cream, ¼ cup diced green onion, 1 ½ tablespoons taco seasoning mix, 2 tablespoons minced jalapeno pepper; or to taste (optional), 1 cup black beans; rinsed and drained"
Tangy Honey Glazed Ham,https://www.allrecipes.com/recipe/24501/tangy-honey-glazed-ham/,"1 (10 pound) fully-cooked; bone-in ham, 1 ¼ cups packed dark brown sugar, ⅓ cup pineapple juice, ⅓ cup honey, ⅓ large orange; juiced and zested, 2 tablespoons Dijon mustard, ¼ teaspoon ground cloves"
