Butternut Squash Soup II,https://www.allrecipes.com/recipe/77981/butternut-squash-soup-ii/,"2 tablespoons butter, 1 small onion; chopped, 1 stalk celery; chopped, 1 medium carrot; chopped, 2 medium potatoes; cubed, 1 medium butternut squash - peeled; seeded; and cubed, 1 (32 fluid ounce) container chicken stock, salt and freshly ground black pepper to taste"
Sweet Potato Casserole II,https://www.allrecipes.com/recipe/13478/sweet-potato-casserole-ii/,"5 sweet potatoes; sliced, 1/4 cup reduced fat margarine, 1/2 cup packed brown sugar, 3 tablespoons orange juice, 1 pinch ground cinnamon, 1 (10.5 ounce) package miniature marshmallows"
Crispy and Tender Baked Chicken Thighs,https://www.allrecipes.com/recipe/235151/crispy-and-tender-baked-chicken-thighs/,"cooking spray, 8 bone-in chicken thighs with skin, ¼ teaspoon garlic salt, ¼ teaspoon onion salt, ¼ teaspoon dried oregano, ¼ teaspoon ground thyme, ¼ teaspoon paprika, ¼ teaspoon ground black pepper"
Delicious Egg Salad for Sandwiches,https://www.allrecipes.com/recipe/147103/delicious-egg-salad-for-sandwiches/,"8 eggs, 1/2 cup mayonnaise, 1 teaspoon prepared yellow mustard, 1/4 cup chopped green onion, salt and pepper to taste, 1/4 teaspoon paprika"
Jan's Pretzel Dogs ,https://www.allrecipes.com/recipe/217962/jans-pretzel-dogs/,"1 (12 fluid ounce) can or bottle room temperature beer, 1 tablespoon white sugar, 2 teaspoons kosher salt, 1 (.25 ounce) package active dry yeast, 4 1/2 cups bread flour, 1/4 cup unsalted butter; melted, 1 large egg yolk, 1 tablespoon water, 10 cups water, 2/3 cup baking soda, 1/4 cup kosher salt; divided - or to taste, 18 hot dogs"
Quick Chili I,https://www.allrecipes.com/recipe/13329/quick-chili-i/,"2 pounds ground beef, 1 onion; finely diced, 3 cloves garlic; minced, 1 (14.5 ounce) can diced tomatoes, 2 (14.5 ounce) cans diced tomatoes with green chile peppers, 1 (8 ounce) can tomato sauce, 1 cup water, 1 (15 ounce) can kidney beans, 1 (15 ounce) can pinto beans, 2 tablespoons chili powder, 1 tablespoon ground cumin, 2 tablespoons white sugar, 1 tablespoon salt, 1 teaspoon ground black pepper, 1 tablespoon hot pepper sauce"
Blackened Salmon Fillets,https://www.allrecipes.com/recipe/36487/blackened-salmon-fillets/,"2 tablespoons ground paprika, 1 tablespoon ground cayenne pepper, 1 tablespoon onion powder, 2 teaspoons salt, 1/2 teaspoon ground white pepper, 1/2 teaspoon ground black pepper, 1/4 teaspoon dried thyme, 1/4 teaspoon dried basil, 1/4 teaspoon dried oregano, 4 salmon fillets; skin and bones removed, 1/2 cup unsalted butter; melted"
Jalapeno Popper Mushrooms,https://www.allrecipes.com/recipe/218787/jalapeno-popper-mushrooms/,"2 slices bacon, cooking spray, 1 1/2 teaspoons olive oil, 8 mushrooms; stems removed and chopped and caps reserved, 1 clove garlic; minced, 1 jalapeno pepper; ribs and seeds removed; finely chopped, 1 (3 ounce) package cream cheese; softened, 3 tablespoons shredded Cheddar cheese, sea salt to taste, ground black pepper to taste"
Skillet-Braised Brussels Sprouts,https://www.allrecipes.com/recipe/235449/skillet-braised-brussels-sprouts/,"4 slices thick-cut bacon; sliced into 1/4-inch strips; or more to taste, 1 pound Brussels sprouts; trimmed and halved; or more to taste, 1 clove garlic; thinly sliced; or more to taste, ½ cup chicken stock; or more as needed, 1 tablespoon butter; or to taste, 1 tablespoon balsamic vinegar; or more to taste, salt and ground black pepper to taste"
Chef John's Chicken Marsala ,https://www.allrecipes.com/recipe/237928/chef-johns-chicken-marsala/,"2 skin-on; boneless chicken breast halves, 1 teaspoon salt and ground black pepper to taste, 3 tablespoons butter; divided, 2 tablespoons olive oil, 5 white mushrooms; sliced, 1 shallot; minced, 1 tablespoon all-purpose flour, 1 cup Marsala wine, 2 cups chicken stock, 2 tablespoons chopped fresh parsley, 1 teaspoon cold butter"
Shoyu Chicken,https://www.allrecipes.com/recipe/202463/shoyu-chicken/,"1 cup soy sauce, 1 cup brown sugar, 1 cup water, 4 cloves garlic; minced, 1 onion; chopped, 1 tablespoon grated fresh ginger root, 1 tablespoon ground black pepper, 1 tablespoon dried oregano, 1 teaspoon crushed red pepper flakes (optional), 1 teaspoon ground cayenne pepper (optional), 1 teaspoon ground paprika (optional), 5 pounds skinless chicken thighs"
Rhubarb Cake I,https://www.allrecipes.com/recipe/7468/rhubarb-cake-i/,"½ cup butter, 1 ½ cups white sugar, 1 egg, 1 teaspoon vanilla extract, 2 cups all-purpose flour, 1 teaspoon baking soda, ¼ teaspoon salt, 1 cup buttermilk, 2 cups rhubarb; chopped, 1 tablespoon all-purpose flour, ¼ cup butter, 2 teaspoons ground cinnamon, 1 cup packed brown sugar"
Cajun Chicken and Sausage Gumbo,https://www.allrecipes.com/recipe/141114/cajun-chicken-and-sausage-gumbo/,"1 cup vegetable oil, 1 cup all-purpose flour, 1 large onion; chopped, 1 large green bell pepper; chopped, 2 celery stalks; chopped, 1 pound andouille or smoked sausage; sliced 1/4 inch thick, 4 cloves garlic; minced, salt and pepper to taste, Creole seasoning to taste, 6 cups chicken broth, 1 bay leaf, 1 rotisserie chicken; boned and shredded"
Avocado Mango Salsa,https://www.allrecipes.com/recipe/89595/avocado-mango-salsa/,"1 avocado - peeled; pitted and diced, 1 lime; juiced, 1 mango - peeled; seeded and diced, 1 small red onion; chopped, 1 habanero pepper; seeded and chopped, 1 tablespoon chopped fresh cilantro, salt to taste"
Basic Crepes,https://www.allrecipes.com/recipe/16383/basic-crepes/,"1 cup all-purpose flour, 2 eggs, 1/2 cup milk, 1/2 cup water, 1/4 teaspoon salt, 2 tablespoons butter; melted"
Ice Cream Sandwich Cake,https://www.allrecipes.com/recipe/232742/ice-cream-sandwich-cake/,"24 vanilla ice cream sandwiches; unwrapped, 2 (8 ounce) containers whipped topping (such as Cool Whip®); thawed, 1 (12 ounce) jar hot fudge ice cream topping; warmed, 1 (12 ounce) jar caramel ice cream topping, 1/4 cup chopped pecans; or to taste"
Best Toffee Ever - Super Easy,https://www.allrecipes.com/recipe/73412/best-toffee-ever-super-easy/,"2 cups butter, 2 cups white sugar, 1/4 teaspoon salt, 2 cups semisweet chocolate chips, 1 cup finely chopped almonds"
Creamy Potato Leek Soup II,https://www.allrecipes.com/recipe/22927/creamy-potato-leek-soup-ii/,"8 potatoes; peeled and cubed, 4 cups chicken broth, 1 pound bacon; cut into 1 inch pieces, 3 leeks; sliced, 1 cup heavy cream"
Oven Roasted Potatoes,https://www.allrecipes.com/recipe/20963/oven-roasted-potatoes/,"1/8 cup olive oil, 1 tablespoon minced garlic, 1/2 teaspoon dried basil, 1/2 teaspoon dried marjoram, 1/2 teaspoon dried dill weed, 1/2 teaspoon dried thyme, 1/2 teaspoon dried oregano, 1/2 teaspoon dried parsley, 1/2 teaspoon crushed red pepper flakes, 1/2 teaspoon salt, 4 large potatoes; peeled and cubed"
Best Chocolate Chip Cookies,https://www.allrecipes.com/recipe/10813/best-chocolate-chip-cookies/,"1 cup butter; softened, 1 cup white sugar, 1 cup packed brown sugar, 2 eggs, 2 teaspoons vanilla extract, 1 teaspoon baking soda, 2 teaspoons hot water, ½ teaspoon salt, 3 cups all-purpose flour, 2 cups semisweet chocolate chips, 1 cup chopped walnuts"
Whole Wheat Honey Bread,https://www.allrecipes.com/recipe/7058/whole-wheat-honey-bread/,"1 1/8 cups water, 3 cups whole wheat flour, 1 1/2 teaspoons salt, 1/3 cup honey, 1 tablespoon dry milk powder, 1 1/2 tablespoons shortening, 1 1/2 teaspoons active dry yeast"
Frog Cupcakes,https://www.allrecipes.com/recipe/149360/frog-cupcakes/,"1 (18.25 ounce) package white cake mix, 1 (16 ounce) can prepared vanilla frosting, 6 drops green food coloring; or as needed, ¼ cup green decorator sugar, 12 large marshmallows, 48 semisweet chocolate chips, 1 drop red food coloring"
Spiced Sweet Roasted Red Pepper Hummus,https://www.allrecipes.com/recipe/15006/spiced-sweet-roasted-red-pepper-hummus/,"1 (15 ounce) can garbanzo beans; drained, 1 (4 ounce) jar roasted red peppers, 3 tablespoons lemon juice, 1 1/2 tablespoons tahini, 1 clove garlic; minced, 1/2 teaspoon ground cumin, 1/2 teaspoon cayenne pepper, 1/4 teaspoon salt, 1 tablespoon chopped fresh parsley"
Brooke's Best Bombshell Brownies,https://www.allrecipes.com/recipe/143667/brookes-best-bombshell-brownies/,"1 cup butter; melted, 3 cups white sugar, 1 tablespoon vanilla extract, 4 eggs, 1 ½ cups all-purpose flour, 1 cup unsweetened cocoa powder, 1 teaspoon salt, 1 cup semisweet chocolate chips"
Meatball Nirvana,https://www.allrecipes.com/recipe/213742/meatball-nirvana/,"1 pound extra lean ground beef, 1/2 teaspoon sea salt, 1 small onion; diced, 1/2 teaspoon garlic salt, 1 1/2 teaspoons Italian seasoning, 3/4 teaspoon dried oregano, 3/4 teaspoon crushed red pepper flakes, 1 dash hot pepper sauce (such as Frank's RedHot®); or to taste, 1 1/2 tablespoons Worcestershire sauce, 1/3 cup skim milk, 1/4 cup grated Parmesan cheese, 1/2 cup seasoned bread crumbs"
Muesli,https://www.allrecipes.com/recipe/14009/muesli/,"4 1/2 cups rolled oats, 1/2 cup toasted wheat germ, 1/2 cup wheat bran, 1/2 cup oat bran, 1 cup raisins, 1/2 cup chopped walnuts, 1/4 cup packed brown sugar, 1/4 cup raw sunflower seeds"
Chicken Asparagus Roll-Ups,https://www.allrecipes.com/recipe/213645/chicken-asparagus-roll-ups/,"½ cup mayonnaise, 3 tablespoons Dijon mustard, 1 lemon; juiced and zested, 2 teaspoons dried tarragon, 1 teaspoon ground black pepper, ½ teaspoon salt, 16 spears fresh asparagus; trimmed, 4 skinless; boneless chicken breast halves, 4 slices provolone cheese, 1 cup panko bread crumbs"
Oven Scrambled Eggs,https://www.allrecipes.com/recipe/57459/oven-scrambled-eggs/,"1/2 cup butter or margarine; melted, 24 eggs, 2 1/4 teaspoons salt, 2 1/2 cups milk"
Homemade Wonton Soup,https://www.allrecipes.com/recipe/185519/homemade-wonton-soup/,"1 bunch green onions; cut into 1/2-inch pieces; divided, 6 fresh mushrooms; sliced, 1 pound ground pork, 1 tablespoon sesame oil, 1 tablespoon soy sauce, 1 egg, 1/4 cup dry bread crumbs, 1/4 teaspoon salt, 1/2 teaspoon ground black pepper, 1 (16 ounce) package wonton wrappers, 8 cups chicken broth, 16 uncooked medium shrimp; peeled and deveined (optional), 1 medium head bok choy; torn into 2-inch pieces, 16 snow peas, 1 dash soy sauce; or to taste (optional), 1 dash sesame oil; to taste (optional)"
Three Packet Slow Cooker Roast,https://www.allrecipes.com/recipe/214413/three-packet-slow-cooker-roast/,"1 cup water, 1 (.7 ounce) package dry Italian-style salad dressing mix, 1 (1 ounce) package ranch dressing mix, 1 (.75 ounce) packet dry brown gravy mix, 1 (3 pound) boneless beef chuck roast"
Funnel Cakes IV,https://www.allrecipes.com/recipe/8265/funnel-cakes-iv/,"1/2 teaspoon salt, 2 teaspoons baking powder, 3 2/3 cups all-purpose flour, 3 eggs, 1/4 cup white sugar, 2 cups milk, 1 quart vegetable oil for frying; or as needed, 2 tablespoons confectioners' sugar; or as needed"
Poppy Seed Bread with Glaze,https://www.allrecipes.com/recipe/7001/poppy-seed-bread-with-glaze/,"3 cups all-purpose flour, 1 1/2 teaspoons salt, 1 1/2 teaspoons baking powder, 3 tablespoons poppy seeds, 1 1/2 teaspoons butter flavored extract, 1 1/3 cups vegetable oil, 3 eggs, 1 1/2 cups milk, 2 1/4 cups white sugar, 1 1/2 teaspoons vanilla extract, 1 1/2 teaspoons almond extract, 1/4 cup orange juice, 1/2 teaspoon butter flavored extract, 1/2 teaspoon almond extract, 1 teaspoon vanilla extract, 2 cups confectioners' sugar"
Irresistible Pecan Pie,https://www.allrecipes.com/recipe/18433/irresistible-pecan-pie/,"1 ½ cups all-purpose flour, ½ teaspoon salt, 2 tablespoons white sugar, ½ cup butter; chilled, 4 tablespoons ice water, 3 eggs; beaten, ¾ cup light corn syrup, 2 tablespoons dark corn syrup, ¾ cup light brown sugar, 3 tablespoons butter; melted, 1 pinch salt, ½ cup pecans; finely crushed, 1 cup pecans; quartered, 1 cup pecan halves"
Kofta Kebabs,https://www.allrecipes.com/recipe/106030/kofta-kebabs/,"4 cloves garlic; minced, 1 teaspoon kosher salt, 1 pound ground lamb, 3 tablespoons grated onion, 3 tablespoons chopped fresh parsley, 1 tablespoon ground coriander, 1 teaspoon ground cumin, 1/2 tablespoon ground cinnamon, 1/2 teaspoon ground allspice, 1/4 teaspoon cayenne pepper, 1/4 teaspoon ground ginger, 1/4 teaspoon ground black pepper, 28 bamboo skewers; soaked in water for 30 minutes"
Chocolate Protein Balls,https://www.allrecipes.com/recipe/233985/chocolate-protein-balls/,"1 cup rolled oats, ½ cup natural peanut butter, ⅓ cup honey, ¼ cup chopped dark chocolate, 2 tablespoons flax seeds, 2 tablespoons chia seeds, 1 tablespoon chocolate-flavored protein powder; or to taste"
Vegan Chocolate Cake,https://www.allrecipes.com/recipe/16779/vegan-chocolate-cake/,"1 ½ cups all-purpose flour, 1 cup white sugar, ¼ cup cocoa powder, 1 teaspoon baking soda, ½ teaspoon salt, ⅓ cup vegetable oil, 1 teaspoon vanilla extract, 1 teaspoon distilled white vinegar, 1 cup water"
Parmesan Brussels Sprouts,https://www.allrecipes.com/recipe/228873/parmesan-brussels-sprouts/,"1 tablespoon butter, 2 cloves garlic; chopped, 1 tablespoon butter, 6 Brussels sprouts; trimmed and halved, 1 tablespoon butter, 2 tablespoons shredded Parmesan cheese; or more to taste, salt and ground black pepper to taste"
Marinated Flank Steak,https://www.allrecipes.com/recipe/18074/marinated-flank-steak/,"1/2 cup vegetable oil, 1/3 cup soy sauce, 1/4 cup red wine vinegar, 2 tablespoons fresh lemon juice, 1 1/2 tablespoons Worcestershire sauce, 1 tablespoon Dijon mustard, 2 cloves garlic; minced, 1/2 teaspoon ground black pepper, 1 1/2 pounds flank steak"
Rotisserie Chicken,https://www.allrecipes.com/recipe/93168/rotisserie-chicken/,"1 (3 pound) whole chicken, 1 pinch salt, ¼ cup butter; melted, 1 tablespoon salt, 1 tablespoon paprika, ¼ tablespoon ground black pepper"
Fresh Strawberry Sauce,https://www.allrecipes.com/recipe/221141/fresh-strawberry-sauce/,"1 pint fresh strawberries; hulled, 1/4 cup white sugar; or more to taste, 2 tablespoons water, 1/2 teaspoon balsamic vinegar, 2 tablespoons water, 1 teaspoon cornstarch"
Mouth-Watering Stuffed Mushrooms,https://www.allrecipes.com/recipe/15184/mouth-watering-stuffed-mushrooms/,"12 whole fresh mushrooms, 1 tablespoon vegetable oil, 1 tablespoon minced garlic, 1 (8 ounce) package cream cheese; softened, 1/4 cup grated Parmesan cheese, 1/4 teaspoon ground black pepper, 1/4 teaspoon onion powder, 1/4 teaspoon ground cayenne pepper"
Easy Homemade Pie Crust,https://www.allrecipes.com/recipe/220996/easy-homemade-pie-crust/,"2 1/2 cups all-purpose flour, 1 cup unsalted butter - chilled; cut into tablespoon-size pieces, 1/2 teaspoon salt, 7 tablespoons ice water, 1 tablespoon cider vinegar"
Spinach Lasagna III,https://www.allrecipes.com/recipe/22729/spinach-lasagna-iii/,"20 lasagna noodles, 2 tablespoons olive oil, 1 cup chopped fresh mushrooms, 1 cup chopped onion, 1 tablespoon minced garlic, 2 cups fresh spinach, 3 cups ricotta cheese, 2/3 cup grated Romano cheese, 1 teaspoon salt, 1 teaspoon dried oregano, 1 teaspoon dried basil leaves, 1/2 teaspoon ground black pepper, 1 egg, 3 cups shredded mozzarella cheese, 3 cups tomato pasta sauce, 1 cup grated Parmesan cheese"
Roasted Vegetables,https://www.allrecipes.com/recipe/9377/roasted-vegetables/,"1 small butternut squash; cubed, 2 red bell peppers; seeded and diced, 1 sweet potato; peeled and cubed, 3 Yukon Gold potatoes; cubed, 1 red onion; quartered, 1 tablespoon chopped fresh thyme, 2 tablespoons chopped fresh rosemary, 1/4 cup olive oil, 2 tablespoons balsamic vinegar, salt and freshly ground black pepper"
Grandma's Polish Perogies,https://www.allrecipes.com/recipe/84706/grandmas-polish-perogies/,"4 1/2 cups all-purpose flour, 2 teaspoons salt, 2 tablespoons butter; melted, 2 cups sour cream, 2 eggs, 1 egg yolk, 2 tablespoons vegetable oil, 8 baking potatoes; peeled and cubed, 1 cup shredded Cheddar cheese, 2 tablespoons processed cheese sauce, onion salt to taste (optional), salt and pepper to taste"
Chicken Milano,https://www.allrecipes.com/recipe/19304/chicken-milano/,"1 tablespoon butter, 2 cloves garlic; minced, ½ cup sun-dried tomatoes; chopped, 1 cup chicken broth; divided, 1 cup heavy cream, 1 pound skinless; boneless chicken breast halves, salt and pepper to taste, 2 tablespoons vegetable oil, 2 tablespoons chopped fresh basil, 8 ounces dry fettuccini pasta"
"Cranberry, Sausage and Apple Stuffing",https://www.allrecipes.com/recipe/9115/cranberry-sausage-and-apple-stuffing/,"1 pound sweet Italian sausage; casings removed, ¼ cup butter, 6 cups coarsely chopped leeks, 3 tart apples - peeled; cored and chopped, 2 cups chopped celery, 4 teaspoons poultry seasoning, 2 teaspoons dried rosemary; crushed, 1 cup dried cranberries, 12 cups white bread cubes; baked until slightly dry, 1 ⅓ cups chicken stock, salt and black pepper to taste"
Quick Yeast Rolls,https://www.allrecipes.com/recipe/13827/quick-yeast-rolls/,"2 tablespoons shortening, 3 tablespoons white sugar, 1 cup hot water, 1 (.25 ounce) package active dry yeast, 1 egg; beaten, 1 teaspoon salt, 2 1/4 cups all-purpose flour"
Shrimp Scampi Bake,https://www.allrecipes.com/recipe/25874/shrimp-scampi-bake/,"1 cup butter, 2 tablespoons prepared Dijon-style mustard, 1 tablespoon fresh lemon juice, 1 tablespoon chopped garlic, 1 tablespoon chopped fresh parsley, 2 pounds medium raw shrimp; shelled; deveined; with tails attached"
Oven Fried Parmesan Chicken,https://www.allrecipes.com/recipe/15003/oven-fried-parmesan-chicken/,"1 clove crushed garlic, ¼ pound butter; melted, 1 cup dried bread crumbs, ⅓ cup grated Parmesan cheese, 2 tablespoons chopped fresh parsley, 1 teaspoon salt, ⅛ teaspoon ground black pepper, 1 (4 pound) chicken; cut into pieces"
Coconut Poke Cake,https://www.allrecipes.com/recipe/7994/coconut-poke-cake/,"1 (18.25 ounce) package white cake mix, 1 (14 ounce) can cream of coconut, 1 (14 ounce) can sweetened condensed milk, 1 (16 ounce) package frozen whipped topping; thawed, 1 (8 ounce) package flaked coconut"
Ranch Dressing II,https://www.allrecipes.com/recipe/16131/ranch-dressing-ii/,"1 cup mayonnaise, 1/2 cup sour cream, 1/2 teaspoon dried chives, 1/2 teaspoon dried parsley, 1/2 teaspoon dried dill weed, 1/4 teaspoon garlic powder, 1/4 teaspoon onion powder, 1/8 teaspoon salt, 1/8 teaspoon ground black pepper"
Irish Cream Chocolate Cheesecake,https://www.allrecipes.com/recipe/7284/irish-cream-chocolate-cheesecake/,"1 ½ cups chocolate cookie crumbs, ⅓ cup confectioners' sugar, ⅓ cup unsweetened cocoa powder, ¼ cup butter, 3 (8 ounce) packages cream cheese; softened, 1 ¼ cups white sugar, ¼ cup unsweetened cocoa powder, 3 tablespoons all-purpose flour, 3 eggs, ½ cup sour cream, ¼ cup Irish cream liqueur"
Chicken Breasts in Caper Cream Sauce,https://www.allrecipes.com/recipe/78741/chicken-breasts-in-caper-cream-sauce/,"4 boneless; skinless chicken breast halves, 1 teaspoon lemon pepper, 1 teaspoon salt, 1 teaspoon dried dill weed, 1 teaspoon garlic powder, 3 tablespoons butter, ½ cup whipping cream, 2 tablespoons capers; drained and rinsed"
Oatmeal Pancakes II,https://www.allrecipes.com/recipe/21384/oatmeal-pancakes-ii/,"1/2 cup all-purpose flour, 1/2 cup quick cooking oats, 1 tablespoon white sugar, 1 teaspoon baking powder, 1/2 teaspoon baking soda, 1/2 teaspoon salt, 3/4 cup buttermilk, 1 teaspoon vanilla extract, 2 tablespoons vegetable oil, 1 egg"
Grandma's Lemon Meringue Pie,https://www.allrecipes.com/recipe/15093/grandmas-lemon-meringue-pie/,"1 cup white sugar, 2 tablespoons all-purpose flour, 3 tablespoons cornstarch, ¼ teaspoon salt, 1 ½ cups water, 2 lemons; juiced and zested, 2 tablespoons butter, 4 egg yolks; beaten, 1 (9 inch) pie crust; baked, 4 egg whites, 6 tablespoons white sugar"
Mango Salsa,https://www.allrecipes.com/recipe/48032/mango-salsa/,"1 mango - peeled; seeded; and chopped, 1/4 cup finely chopped red bell pepper, 1 green onion; chopped, 2 tablespoons chopped cilantro, 1 fresh jalapeno chile pepper; finely chopped, 2 tablespoons lime juice, 1 tablespoon lemon juice"
Butternut Squash Casserole,https://www.allrecipes.com/recipe/22936/butternut-squash-casserole/,"1 butternut squash, 1 cup white sugar, 1 1/2 cups milk, 1 teaspoon vanilla extract, 1 pinch salt, 2 tablespoons all-purpose flour, 3 eggs, 1/4 cup margarine; melted, TOPPING, 1/2 (16 ounce) package vanilla wafers; crushed, 1/2 cup margarine; melted, 1 cup brown sugar"
Chef John's Chicken Riggies,https://www.allrecipes.com/recipe/229455/chef-johns-chicken-riggies/,"1 tablespoon olive oil, 4 ounces hot Italian ground sausage meat, 1 cup sliced mushrooms, 1 onion; sliced, salt and ground black pepper to taste, 1 ½ pounds skinless; boneless chicken thighs; roughly chopped, ½ cup Marsala wine, 1 (28 ounce) can whole Italian plum tomatoes (such as San Marzano); crushed, 1 cup chicken broth, ½ cup heavy whipping cream, ½ cup water; or as needed, 1 ½ cups chopped hot and sweet peppers, ½ cup pitted and chopped kalamata olives, 3 cloves garlic; minced, ¼ cup chopped Italian flat leaf parsley, 1 pound rigatoni, ½ cup grated Parmigiano-Reggiano or Romano cheese"
Jenny's Black Forest Cake,https://www.allrecipes.com/recipe/23398/jennys-black-forest-cake/,"1 cup milk, 1 tablespoon vinegar, 1 ¾ cups all-purpose flour, 2 cups white sugar, ¾ cup unsweetened cocoa powder, 1 teaspoon baking powder, 2 teaspoons baking soda, ½ teaspoon salt, 2 eggs, ½ cup vegetable oil, 1 cup strong brewed coffee; cold, 1 teaspoon vanilla extract, 1 (21 ounce) can cherry pie filling, ½ cup cherry liqueur"
Old Fashioned Creamy Rice Pudding,https://www.allrecipes.com/recipe/228914/old-fashioned-creamy-rice-pudding/,"1 1/2 cups cooked rice, 2 cups milk; divided, 1/4 teaspoon salt, 2/3 cup golden raisins (optional), 1 egg; beaten, 1/3 cup white sugar, 1 tablespoon butter, 1/2 teaspoon vanilla extract"
"Sausage, Peppers, Onions, and Potato Bake",https://www.allrecipes.com/recipe/214500/sausage-peppers-onions-and-potato-bake/,"2 teaspoons olive oil, 2 pounds Italian sausage links; cut into 2-inch pieces, ¼ cup olive oil, 4 large potatoes; peeled and thickly sliced, 2 large green bell peppers; seeded and cut into wedges, 2 large red bell peppers; seeded and cut into wedges, 3 large onions; cut into wedges, ½ cup white wine, ½ cup chicken stock, 1 teaspoon Italian seasoning, salt and pepper to taste"
Pumpkin Whoopie Pies,https://www.allrecipes.com/recipe/11331/pumpkin-whoopie-pies/,"2 cups packed brown sugar, 1 cup vegetable oil, 1 ½ cups solid pack pumpkin puree, 2 eggs, 3 cups all-purpose flour, 1 teaspoon salt, 1 teaspoon baking powder, 1 teaspoon baking soda, 1 teaspoon vanilla extract, 1 ½ tablespoons ground cinnamon, ½ tablespoon ground ginger, ½ tablespoon ground cloves, 1 egg white, 2 tablespoons milk, 1 teaspoon vanilla extract, 2 cups confectioners' sugar, ¾ cup shortening"
Grilled Lamb with Brown Sugar Glaze,https://www.allrecipes.com/recipe/47822/grilled-lamb-with-brown-sugar-glaze/,"1/4 cup brown sugar, 2 teaspoons ground ginger, 2 teaspoons dried tarragon, 1 teaspoon ground cinnamon, 1 teaspoon ground black pepper, 1 teaspoon garlic powder, 1/2 teaspoon salt, 4 lamb chops"
Stuffed Shells I,https://www.allrecipes.com/recipe/11836/stuffed-shells-i/,"1 (16 ounce) package jumbo pasta shells, 4 cups large curd cottage cheese, 12 ounces mozzarella cheese; shredded, 1/2 cup grated Parmesan cheese, 2 eggs; lightly beaten, 1 pinch garlic powder, 1 teaspoon dried oregano, 1 teaspoon dried parsley, 1 (26 ounce) jar spaghetti sauce, 1/4 cup grated Parmesan cheese"
Vanilla Pastry Cream,https://www.allrecipes.com/recipe/7553/vanilla-pastry-cream/,"2 cups milk, ½ cup white sugar, 1 vanilla bean; halved lengthwise, 6 egg yolks, 4 tablespoons all-purpose flour, 4 tablespoons unsalted butter, 1 pinch salt"
Original Irish Cream,https://www.allrecipes.com/recipe/23534/original-irish-cream/,"1 cup heavy cream, 1 (14 ounce) can sweetened condensed milk, 1 2/3 cups Irish whiskey, 1 teaspoon instant coffee granules, 2 tablespoons chocolate syrup, 1 teaspoon vanilla extract, 1 teaspoon almond extract"
How to Cook a Turkey,https://www.allrecipes.com/recipe/222332/how-to-cook-a-turkey/,"1 onion; coarsely chopped, 1 stalk celery; coarsely chopped, 1 carrot; coarsely chopped, 1 (12 pound) whole turkey; neck and giblets reserved, 2 tablespoons kosher salt, 1 tablespoon ground black pepper, 1 teaspoon cayenne pepper, 3 tablespoons butter, 4 sprigs fresh rosemary, 1/2 bunch chopped fresh sage"
Chef John's Meatless Meatballs,https://www.allrecipes.com/recipe/232908/chef-johns-meatless-meatballs/,"1 tablespoon olive oil, 1 pound fresh white mushrooms; finely chopped, 1 pinch salt, 1 tablespoon butter, 1/2 cup finely chopped onion, 4 cloves garlic; minced, 1/2 cup quick-cooking oats, 1 ounce very finely shredded Parmigiano-Reggiano cheese, 1/2 cup bread crumbs, 1/4 cup chopped flat-leaf (Italian) parsley; packed, 2 eggs; divided, 1 teaspoon salt, freshly ground black pepper to taste, 1 pinch cayenne pepper; or to taste, 1 pinch dried oregano, 3 cups pasta sauce, 1 tablespoon very finely shredded Parmigiano-Reggiano cheese; or to taste, 1 tablespoon chopped flat-leaf (Italian) parsley; or to taste"
Absolutely Fabulous Greek/House Dressing,https://www.allrecipes.com/recipe/36520/absolutely-fabulous-greekhouse-dressing/,"1 1/2 quarts olive oil, 1/3 cup garlic powder, 1/3 cup dried oregano, 1/3 cup dried basil, 1/4 cup pepper, 1/4 cup salt, 1/4 cup onion powder, 1/4 cup Dijon-style mustard, 2 quarts red wine vinegar"
Basic Flaky Pie Crust,https://www.allrecipes.com/recipe/12133/basic-flaky-pie-crust/,"1 1/4 cups all-purpose flour, 1/4 teaspoon salt, 1/2 cup shortening; chilled, 3 tablespoons ice water"
