Chocolate Chip Cheese Ball,https://www.allrecipes.com/recipe/26740/chocolate-chip-cheese-ball/,"1 (8 ounce) package cream cheese; softened, 1/2 cup butter; softened, 3/4 cup confectioners' sugar, 2 tablespoons brown sugar, 1/4 teaspoon vanilla extract, 3/4 cup miniature semisweet chocolate chips, 3/4 cup finely chopped pecans"
Easy Herb Roasted Turkey,https://www.allrecipes.com/recipe/41393/easy-herb-roasted-turkey/,"1 (12 pound) whole turkey, 3/4 cup olive oil, 2 tablespoons garlic powder, 2 teaspoons dried basil, 1 teaspoon ground sage, 1 teaspoon salt, 1/2 teaspoon black pepper, 2 cups water"
Creamy Dill Cucumber Toasties,https://www.allrecipes.com/recipe/14811/creamy-dill-cucumber-toasties/,"1 (8 ounce) package cream cheese; softened, 1 (.7 ounce) package dry Italian-style salad dressing mix, 1/2 cup mayonnaise, 1 French baguette; cut into 1/2 inch thick circles, 1 cucumber; sliced, 2 teaspoons dried dill weed"
Red Broccoli Salad,https://www.allrecipes.com/recipe/14178/red-broccoli-salad/,"2 pounds maple-flavored bacon, 1 large head fresh broccoli; chopped, ¾ cup chopped celery, ¼ cup minced green onions, ¼ cup diced red onion, 1 ½ cups seedless grapes; halved, ¾ cup blanched slivered almonds, ¼ cup white sugar, 2 tablespoons distilled white vinegar, 1 cup mayonnaise"
German Chocolate Cake Frosting II,https://www.allrecipes.com/recipe/19118/german-chocolate-cake-frosting-ii/,"1 cup evaporated milk, 1 cup white sugar, 3 egg yolk; beaten with 1 teaspoon water, 1/2 cup margarine, 1 teaspoon vanilla extract, 1 cup chopped pecans, 1 cup flaked coconut"
Ninety Minute Cinnamon Rolls,https://www.allrecipes.com/recipe/17006/ninety-minute-cinnamon-rolls/,"3/4 cup milk, 1/4 cup margarine; softened, 3 1/4 cups all-purpose flour, 1 (.25 ounce) package instant yeast, 1/4 cup white sugar, 1/2 teaspoon salt, 1/4 cup water, 1 egg, 1 cup brown sugar; packed, 1 tablespoon ground cinnamon, 1/2 cup margarine; softened, 1/2 cup raisins (optional)"
Artichoke & Spinach Dip Restaurant Style,https://www.allrecipes.com/recipe/33474/artichoke-spinach-dip-restaurant-style/,"4 cloves garlic, 1 (10 ounce) package frozen chopped spinach; thawed and drained, 1 (14 ounce) can artichoke hearts; drained and chopped, 1 (10 ounce) container Alfredo-style pasta sauce, 1 cup shredded mozzarella cheese, 1/3 cup grated Parmesan cheese, 1/2 (8 ounce) package cream cheese; softened"
Split Pea Soup,https://www.allrecipes.com/recipe/13384/split-pea-soup/,"2 ¼ cups dried split peas, 2 quarts cold water, 1 ½ pounds ham bone, 2 onions; thinly sliced, ½ teaspoon salt, ¼ teaspoon ground black pepper, 1 pinch dried marjoram, 3 stalks celery; chopped, 3 carrots; chopped, 1 potato; diced"
White Chocolate Macadamia Cranberry Dreams,https://www.allrecipes.com/recipe/10511/white-chocolate-macadamia-cranberry-dreams/,"3 cups all-purpose flour, ¾ teaspoon baking soda, ¾ teaspoon salt, ¾ cup white sugar, 1 cup packed light brown sugar, 1 cup butter; softened, 2 eggs; slightly beaten, 1 tablespoon vanilla extract, 1 cup vanilla baking chips, 1 cup chopped macadamia nuts, 1 cup dried cranberries"
Raspberry and Almond Shortbread Thumbprints,https://www.allrecipes.com/recipe/10222/raspberry-and-almond-shortbread-thumbprints/,"1 cup butter; softened, ⅔ cup white sugar, ½ teaspoon almond extract, 2 cups all-purpose flour, ½ cup seedless raspberry jam, ½ cup confectioners' sugar, ¾ teaspoon almond extract, 1 teaspoon milk"
Chicken Wing Dip,https://www.allrecipes.com/recipe/90544/chicken-wing-dip/,"2 (8 ounce) packages cream cheese; softened, ¾ cup pepper sauce (such as Frank's Red Hot®), 1 cup Ranch-style salad dressing, 2 cups diced cooked chicken, 1 cup shredded Cheddar cheese"
Barbequed Ribs,https://www.allrecipes.com/recipe/19856/barbequed-ribs/,"4 pounds baby back pork ribs, 4 cloves garlic; sliced, 1 tablespoon white sugar, 1 tablespoon paprika, 2 teaspoons salt, 2 teaspoons ground black pepper, 2 teaspoons chili powder, 2 teaspoons ground cumin, ½ cup dark brown sugar, ½ cup cider vinegar, ½ cup ketchup, ¼ cup chili sauce, ¼ cup Worcestershire sauce, 1 tablespoon lemon juice, 2 tablespoons onion; chopped, ½ teaspoon dry mustard, 1 clove crushed garlic"
Grilled Asparagus,https://www.allrecipes.com/recipe/17445/grilled-asparagus/,"1 pound fresh asparagus spears; trimmed, 1 tablespoon olive oil, salt and pepper to taste"
Cha Cha's White Chicken Chili,https://www.allrecipes.com/recipe/22302/cha-chas-white-chicken-chili/,"1 tablespoon vegetable oil, 1 onion; chopped, 3 cloves garlic; crushed, 1 (4 ounce) can diced jalapeno peppers, 1 (4 ounce) can chopped green chile peppers, 2 teaspoons ground cumin, 1 teaspoon dried oregano, 1 teaspoon ground cayenne pepper, 2 (14.5 ounce) cans chicken broth, 3 cups chopped cooked chicken breast, 3 (15 ounce) cans white beans, 1 cup shredded Monterey Jack cheese"
Bread and Celery Stuffing,https://www.allrecipes.com/recipe/13693/bread-and-celery-stuffing/,"1 (1 pound) loaf sliced white bread, 3/4 cup butter or margarine, 1 onion; chopped, 4 stalks celery; chopped, 2 teaspoons poultry seasoning, salt and pepper to taste, 1 cup chicken broth"
Black Bean and Couscous Salad,https://www.allrecipes.com/recipe/24833/black-bean-and-couscous-salad/,"1 cup uncooked couscous, 1 1/4 cups chicken broth, 3 tablespoons extra virgin olive oil, 2 tablespoons fresh lime juice, 1 teaspoon red wine vinegar, 1/2 teaspoon ground cumin, 8 green onions; chopped, 1 red bell pepper; seeded and chopped, 1/4 cup chopped fresh cilantro, 1 cup frozen corn kernels; thawed, 2 (15 ounce) cans black beans; drained, salt and pepper to taste"
Chef John's Turkey Sloppy Joes,https://www.allrecipes.com/recipe/223050/chef-johns-turkey-sloppy-joes/,"2 tablespoons butter, 1 onion; diced, salt and ground black pepper to taste, 1 1/4 pounds ground turkey, 1/2 cup cold water, 3/4 cup ketchup, 1 1/2 tablespoons brown sugar, 1/2 teaspoon cayenne pepper; or to taste, 1/2 teaspoon Worcestershire sauce, 1/2 teaspoon unsweetened cocoa powder, 1 cup water; or as needed, 6 hamburger buns; split, 1/3 cup chopped green onions, 1/2 cup shredded white Cheddar cheese"
Peanut Butter Pie,https://www.allrecipes.com/recipe/9174/peanut-butter-pie/,"1 (9 inch) prepared graham cracker crust, 1 (8 ounce) package cream cheese; softened, ½ cup creamy peanut butter, ½ cup confectioners' sugar, 1 (16 ounce) container frozen whipped topping; thawed, 15 miniature chocolate covered peanut butter cups; unwrapped"
Smothered Chicken Breasts,https://www.allrecipes.com/recipe/222607/smothered-chicken-breasts/,"4 (6 ounce) skinless; boneless chicken breast halves, ¼ teaspoon salt, ¼ teaspoon lemon pepper seasoning, 1 tablespoon vegetable oil, 8 strips bacon, 1 onion; sliced, ¼ cup packed brown sugar, ½ cup shredded Colby-Monterey Jack cheese"
Rhubarb Strawberry Crunch,https://www.allrecipes.com/recipe/12177/rhubarb-strawberry-crunch/,"1 cup white sugar, 3 tablespoons all-purpose flour, 3 cups sliced fresh strawberries, 3 cups diced rhubarb, 1 1/2 cups all-purpose flour, 1 cup packed brown sugar, 1 cup butter, 1 cup rolled oats"
4H Banana Bread,https://www.allrecipes.com/recipe/6765/4h-banana-bread/,"2 cups all-purpose flour, 1/2 teaspoon baking soda, 1 cup white sugar, 1 egg, 5 tablespoons milk, 1 teaspoon baking powder, 1/2 teaspoon salt, 1/2 cup margarine, 1 cup mashed bananas, 1/2 cup chopped walnuts (optional)"
Buffalo Chicken Wing Sauce,https://www.allrecipes.com/recipe/219109/buffalo-chicken-wing-sauce/,"2/3 cup hot pepper sauce (such as Frank's RedHot®), 1/2 cup cold unsalted butter, 1 1/2 tablespoons white vinegar, 1/4 teaspoon Worcestershire sauce, 1/4 teaspoon cayenne pepper, 1/8 teaspoon garlic powder, salt to taste"
Authentic Mexican Shrimp Cocktail (Coctel de Camarones estilo Mexicano),https://www.allrecipes.com/recipe/228393/authentic-mexican-shrimp-cocktail-coctel-de-camarones-estilo-mexicano/,"1/3 cup Spanish onion; chopped, 1/4 cup freshly squeezed lime juice, 1 pound chilled cooked medium shrimp - peeled; deveined; and tails removed, 2 roma (plum) tomatoes; chopped, 1 cucumber; finely chopped, 1 stalk celery; finely chopped, 1 jalapeno pepper; seeded and finely chopped, 2 teaspoons salt, 2 teaspoons ground black pepper, 1 1/2 cups chilled tomato and clam juice cocktail (such as Clamato®), 1 cup chilled ketchup (such as Heinz®), 1 bunch fresh cilantro - stems discarded and leaves chopped, 2 tablespoons hot pepper sauce (such as Valentina®), 2 avocados - peeled; pitted; and chopped"
Easy Baklava,https://www.allrecipes.com/recipe/20287/easy-baklava/,"1 pound chopped nuts, 1 teaspoon ground cinnamon, 1 (16 ounce) package phyllo dough, 1 cup butter; melted, 1 cup white sugar, 1 cup water, 1/2 cup honey, 1 teaspoon vanilla extract, 1 teaspoon grated lemon zest"
Snickerdoodles I,https://www.allrecipes.com/recipe/11624/snickerdoodles-i/,"1 cup shortening, 1 ½ cups white sugar, 2 eggs, 2 ¾ cups all-purpose flour, 1 teaspoon baking soda, 2 teaspoons cream of tartar, ½ teaspoon salt, 2 tablespoons white sugar, 2 teaspoons ground cinnamon"
Chef John's Scones,https://www.allrecipes.com/recipe/220994/chef-johns-scones/,"1 ¾ cups all-purpose flour, ¼ cup white sugar, 4 teaspoons baking powder, ⅛ teaspoon salt, 5 tablespoons unsalted butter, ½ cup milk, ¼ cup sour cream, ⅓ cup dried currants, 1 egg; lightly beaten, 1 tablespoon milk"
Cracked Sugar Cookies I,https://www.allrecipes.com/recipe/9864/cracked-sugar-cookies-i/,"1 ¼ cups white sugar, 1 cup butter, 3 egg yolks, 1 teaspoon vanilla extract, 2 ½ cups all-purpose flour, 1 teaspoon baking soda, ½ teaspoon cream of tartar"
Super Simple Salmon,https://www.allrecipes.com/recipe/189058/super-simple-salmon/,"1 tablespoon garlic powder, 1 tablespoon dried basil, 1/2 teaspoon salt, 4 (6 ounce) salmon, 2 tablespoons butter, 4 lemon wedges"
Vegetarian Mexican Inspired Stuffed Peppers,https://www.allrecipes.com/recipe/231514/vegetarian-mexican-inspired-stuffed-peppers/,"1 tablespoon salt, 4 large green bell peppers - tops; seeds; and membranes removed, 1 tablespoon olive oil, 1/2 cup chopped onion, 2 cups cooked rice, 1 (15 ounce) can black beans; drained and rinsed, 1 (14.5 ounce) can chili-style diced tomatoes, 1 teaspoon chili powder, 1 teaspoon garlic salt, 1/2 teaspoon ground cumin, 1/2 teaspoon salt, 1 (8 ounce) package shredded Mexican cheese blend (such as Sargento® Authentic Mexican)"
Chef John's Classic Macaroni Salad,https://www.allrecipes.com/recipe/244305/chef-johns-classic-macaroni-salad/,"1 cup mayonnaise, 1/4 cup white vinegar, 2 tablespoons Dijon mustard, 2 teaspoons kosher salt; or more to taste, 1/2 teaspoon ground black pepper, 1/8 teaspoon cayenne pepper, 1 tablespoon white sugar; or more to taste, 1 cup finely diced celery, 3/4 cup diced red bell pepper, 1/2 cup grated carrot, 1/2 cup chopped green onions; white and light parts, 1/4 cup diced jalapeno pepper, 1/4 cup diced poblano pepper, 1 (16 ounce) package uncooked elbow macaroni, 1 tablespoon mayonnaise (optional), 1 tablespoon water (optional)"
Manicotti,https://www.allrecipes.com/recipe/13883/manicotti/,"1 pint part-skim ricotta cheese, 8 ounces shredded mozzarella cheese, 3/4 cup grated Parmesan cheese, 2 eggs, 1 teaspoon dried parsley, salt to taste, ground black pepper to taste, 1 (16 ounce) jar spaghetti sauce, 5 1/2 ounces manicotti pasta"
Turkey Pot Pie,https://www.allrecipes.com/recipe/9230/turkey-pot-pie/,"1 recipe pastry for a (10 inch) double crust pie, 4 tablespoons butter, 1 small onion; minced, 2 stalks celery; chopped, 2 carrots; diced, 3 tablespoons dried parsley, 1 teaspoon dried oregano, salt and pepper to taste, 2 cubes chicken bouillon, 2 cups water, 3 potatoes; peeled and cubed, 1 1/2 cups cooked turkey; cubed, 3 tablespoons all-purpose flour, 1/2 cup milk"
Christmas Prime Rib,https://www.allrecipes.com/recipe/219587/christmas-prime-rib/,"1 (6 pound) boneless prime rib roast, 2 tablespoons prepared horseradish, 2 tablespoons Dijon mustard, 2 teaspoons kosher salt, 2 teaspoons coarsely ground black pepper, 2 teaspoons dried thyme, 2 teaspoons garlic powder, 2 stalks celery; cut into 2-inch pieces, 1 carrot; cut into 2-inch pieces, 1 small unpeeled onion; quartered and separated, 2 teaspoons concentrated beef base (paste), 1 1/2 cups water, 1 teaspoon cornstarch, 1 teaspoon water"
Mini Cheesecakes I,https://www.allrecipes.com/recipe/7307/mini-cheesecakes-i/,"1 (12 ounce) package vanilla wafers, 2 (8 ounce) packages cream cheese, ¾ cup white sugar, 2 eggs, 1 teaspoon vanilla extract, 1 (21 ounce) can cherry pie filling"
Becky's Chicken Salad,https://www.allrecipes.com/recipe/8565/beckys-chicken-salad/,"2 ½ cups diced and chilled; cooked chicken meat, 1 cup chopped celery, 1 cup sliced; seedless grapes, ½ cup sliced almonds, 2 tablespoons chopped fresh parsley, 1 teaspoon salt, 1 cup mayonnaise, ¼ cup heavy whipping cream"
Chocolate Cornstarch Pudding,https://www.allrecipes.com/recipe/44699/chocolate-cornstarch-pudding/,"1/2 cup white sugar, 3 tablespoons unsweetened cocoa powder, 1/4 cup cornstarch, 1/8 teaspoon salt, 2 3/4 cups milk, 2 tablespoons butter; room temperature, 1 teaspoon vanilla extract"
Best Marinara Sauce Yet,https://www.allrecipes.com/recipe/11966/best-marinara-sauce-yet/,"2 (14.5 ounce) cans stewed tomatoes, 1 (6 ounce) can tomato paste, 4 tablespoons chopped fresh parsley, 1 clove garlic; minced, 1 teaspoon dried oregano, 1 teaspoon salt, 1/4 teaspoon ground black pepper, 6 tablespoons olive oil, 1/3 cup finely diced onion, 1/2 cup white wine"
Mozzarella-Stuffed Pesto Turkey Meatballs,https://www.allrecipes.com/recipe/217899/mozzarella-stuffed-pesto-turkey-meatballs/,"3 pounds ground turkey, 1 cup finely chopped onion, 4 garlic cloves; minced, 1 egg, 1 cup Italian-style bread crumbs, 1/2 cup grated Parmigiano-Reggiano cheese, 1/2 cup chopped fresh flat-leaf parsley, 1/4 cup prepared pesto, 1/4 cup milk, 1 tablespoon salt, 2 teaspoons fresh ground black pepper, 1 pound fresh mozzarella; cut into small cubes, 3 tablespoons extra-virgin olive oil, 2 (24 ounce) jars marinara sauce"
Roast Beef Tenderloin,https://www.allrecipes.com/recipe/221962/roast-beef-tenderloin/,"1/3 cup dried porcini mushrooms, 1 cup warm water, 2 1/2 pounds trimmed beef tenderloin roast; tied, salt and ground black pepper to taste, 1 tablespoon vegetable oil, 1 tablespoon unsalted butter, 1/2 cup sliced shallots, 1 pinch salt, 1/4 cup tarragon vinegar, 1 cup veal stock, 1/4 cup heavy cream, 1 tablespoon unsalted butter, 1 tablespoon chopped fresh tarragon, salt and ground black pepper to taste"
Toddler Muffins,https://www.allrecipes.com/recipe/219330/toddler-muffins/,"1/2 cup butter; softened, 1/2 cup brown sugar; or to taste, 2 large bananas; mashed, 1 (4.5 ounce) jar baby food squash, 2 carrots; grated, 2 eggs; beaten, 1 cup all-purpose flour, 1/2 cup oat bran, 1 teaspoon baking soda, 1 teaspoon pumpkin pie spice, 1/2 teaspoon salt"
Baked Teriyaki Chicken,https://www.allrecipes.com/recipe/9023/baked-teriyaki-chicken/,"1 tablespoon cornstarch, 1 tablespoon cold water, ½ cup white sugar, ½ cup soy sauce, ¼ cup cider vinegar, 1 clove garlic; minced, ½ teaspoon ground ginger, ¼ teaspoon ground black pepper, 12 skinless chicken thighs"
Vegan Banana Muffins,https://www.allrecipes.com/recipe/233146/vegan-banana-muffins/,"3 cups all-purpose flour, 1 cup white sugar, 1/2 cup brown sugar, 2 teaspoons ground cinnamon, 2 teaspoons baking powder, 1 teaspoon baking soda, 1 teaspoon ground nutmeg, 1 teaspoon salt, 2 cups mashed ripe bananas, 1 cup canola oil, 1 cup coconut milk"
Cobb Salad,https://www.allrecipes.com/recipe/14415/cobb-salad/,"6 slices bacon, 3 eggs, 1 head iceberg lettuce; shredded, 3 cups chopped; cooked chicken meat, 2 tomatoes; seeded and chopped, ¾ cup blue cheese; crumbled, 1 avocado - peeled; pitted and diced, 3 green onions; chopped, 1 (8 ounce) bottle Ranch-style salad dressing"
Tartar Sauce I,https://www.allrecipes.com/recipe/12788/tartar-sauce-i/,"1 cup mayonnaise, 1 tablespoon sweet pickle relish, 1 tablespoon minced onion, 2 tablespoons lemon juice (optional), salt and pepper to taste"
Strawberry Pretzel Salad,https://www.allrecipes.com/recipe/20338/strawberry-pretzel-salad/,"2 cups crushed pretzels, 3/4 cup butter; melted, 3 tablespoons white sugar, 1 (8 ounce) package cream cheese; softened, 1 cup white sugar, 1 (8 ounce) container frozen whipped topping; thawed, 2 (3 ounce) packages strawberry flavored Jell-O®, 2 cups boiling water, 2 (10 ounce) packages frozen strawberries"
Hot Buttered Rum Batter,https://www.allrecipes.com/recipe/23040/hot-buttered-rum-batter/,"1 pound butter, 1 pound brown sugar, 1 pound confectioners' sugar, 1 quart vanilla ice cream; softened, 1 tablespoon ground cinnamon, 1 teaspoon ground nutmeg"
Chocolate Chip Cheesecake I,https://www.allrecipes.com/recipe/15058/chocolate-chip-cheesecake-i/,"1 ½ cups graham cracker crumbs, ⅓ cup white sugar, ⅓ cup unsweetened cocoa powder, ⅓ cup butter; melted, 3 (8 ounce) packages cream cheese, 1 (14 ounce) can sweetened condensed milk, 3 eggs, 2 teaspoons vanilla extract, 1 cup mini semi-sweet chocolate chips, 1 teaspoon all-purpose flour"
Baked Buffalo Chicken Dip,https://www.allrecipes.com/recipe/221131/baked-buffalo-chicken-dip/,"3 cups diced cooked rotisserie chicken, 2 (8 ounce) packages cream cheese; softened, ¾ cup hot pepper sauce (such as Frank's RedHot®), ½ cup shredded pepper Jack cheese, ½ cup blue cheese dressing, ½ cup crumbled blue cheese, ½ teaspoon seafood seasoning (such as Old Bay®), 1 pinch cayenne pepper; or to taste, 2 tablespoons shredded pepper Jack cheese, 1 pinch cayenne pepper; for garnish"
Boudreaux's Zydeco Stomp Gumbo,https://www.allrecipes.com/recipe/21392/boudreauxs-zydeco-stomp-gumbo/,"1 tablespoon olive oil, 1 cup skinless; boneless chicken breast halves - chopped, ½ pound pork sausage links; thinly sliced, 1 cup olive oil, 1 cup all-purpose flour, 2 tablespoons minced garlic, 3 quarts chicken broth, 1 (12 fluid ounce) can or bottle beer, 6 stalks celery; diced, 4 roma (plum) tomatoes; diced, 1 sweet onion; sliced, 1 (10 ounce) can diced tomatoes with green chile peppers; with liquid, 2 tablespoons chopped fresh red chile peppers, 1 bunch fresh parsley; chopped, ¼ cup Cajun seasoning, 1 pound shrimp; peeled and deveined"
Honey Glazed Ham,https://www.allrecipes.com/recipe/14745/honey-glazed-ham/,"1 (5 pound) ready-to-eat ham, ¼ cup whole cloves, ¼ cup dark corn syrup, 2 cups honey, ⅔ cup butter"
Cornucopia,https://www.allrecipes.com/recipe/13462/cornucopia/,"3 (11 ounce) containers refrigerated soft bread stick dough, 1 egg, 1 tablespoon water"
Mississippi Roast - Slow Cooker Pepperoncini Pot Roast,https://www.allrecipes.com/recipe/246721/mississippi-roast-slow-cooker-pepperoncini-pot-roast/,"1 (4 pound) beef chuck roast, 1/4 cup butter, 5 pepperoncini peppers, 1 (1 ounce) packet ranch dressing mix, 1 (1 ounce) packet dry au jus mix"
Chef John's Sausage & Shrimp Jambalaya,https://www.allrecipes.com/recipe/220126/chef-johns-sausage-shrimp-jambalaya/,"2 tablespoons butter, 8 ounces andouille sausage; cut into 1/4-inch slices, 2 tablespoons ground paprika, 1 tablespoon ground cumin, 1/2 teaspoon cayenne pepper, 1/2 cup diced tomatoes, 1 large green bell pepper; diced, 2 stalks celery; sliced 1/4 inch thick, 4 green onions; thinly sliced, 1 teaspoon salt, 1 bay leaf, 1 cup uncooked brown rice, 3 cups chicken stock, 1 pound large shrimp; peeled and deveined, salt and ground black pepper to taste"
Chicken Souvlaki with Tzatziki Sauce,https://www.allrecipes.com/recipe/231644/chicken-souvlaki-with-tzatziki-sauce/,"¼ cup olive oil, 2 tablespoons lemon juice, 2 cloves garlic; minced, 1 teaspoon dried oregano, ½ teaspoon salt, 1 ½ pounds skinless; boneless chicken breast halves - cut into bite-sized pieces, 1 (6 ounce) container plain Greek-style yogurt, ½ cucumber - peeled; seeded; and grated, 1 tablespoon olive oil, 2 teaspoons white vinegar, 1 clove garlic; minced, 1 pinch salt, 6 wooden skewers; or as needed"
Red and Green Christmas Jalapeno Jelly,https://www.allrecipes.com/recipe/19137/red-and-green-christmas-jalapeno-jelly/,"1 cup chopped red bell pepper, 1/2 cup chopped jalapeno pepper, 5 cups white sugar, 1 1/2 cups apple cider vinegar, 1 (6 fluid ounce) container liquid pectin"
Baked Potato Soup I,https://www.allrecipes.com/recipe/12997/baked-potato-soup-i/,"12 slices bacon, ⅔ cup margarine, ⅔ cup all-purpose flour, 7 cups milk, 4 large baked potatoes; peeled and cubed, 4 green onions; chopped, 1 ¼ cups shredded Cheddar cheese, 1 cup sour cream, 1 teaspoon salt, 1 teaspoon ground black pepper"
Freezer Caramel Drizzle Pie,https://www.allrecipes.com/recipe/17706/freezer-caramel-drizzle-pie/,"2 (9 inch) prepared graham cracker crusts, 6 tablespoons butter, 1 (7 ounce) package shredded coconut, 1 cup chopped pecans, 1 (14 ounce) can sweetened condensed milk, 1 (8 ounce) package cream cheese; softened, 1 (16 ounce) container frozen whipped topping; thawed, 1 (12 ounce) jar caramel ice cream topping"
Healing Cabbage Soup,https://www.allrecipes.com/recipe/82923/healing-cabbage-soup/,"3 tablespoons olive oil, 1/2 onion; chopped, 2 cloves garlic; chopped, 2 quarts water, 4 teaspoons chicken bouillon granules, 1 teaspoon salt; or to taste, 1/2 teaspoon black pepper; or to taste, 1/2 head cabbage; cored and coarsely chopped, 1 (14.5 ounce) can Italian-style stewed tomatoes; drained and diced"
Crazy Cake,https://www.allrecipes.com/recipe/7475/crazy-cake/,"3 cups all-purpose flour, 2 cups white sugar, 1 teaspoon salt, 2 teaspoons baking soda, ½ cup unsweetened cocoa powder, ¾ cup vegetable oil, 2 tablespoons distilled white vinegar, 2 teaspoons vanilla extract, 2 cups cold water"
Best Bread Machine Bread,https://www.allrecipes.com/recipe/17215/best-bread-machine-bread/,"1 cup warm water (110 degrees F/45 degrees C), 2 tablespoons white sugar, 1 (.25 ounce) package bread machine yeast, 1/4 cup vegetable oil, 3 cups bread flour, 1 teaspoon salt"
The Best Fresh Tomato Salsa,https://www.allrecipes.com/recipe/214893/the-best-fresh-tomato-salsa/,"3 cups chopped tomatoes, 1/2 cup chopped green bell pepper, 1 cup onion; diced, 1/4 cup minced fresh cilantro, 2 tablespoons fresh lime juice, 4 teaspoons chopped fresh jalapeno pepper (including seeds), 1/2 teaspoon ground cumin, 1/2 teaspoon kosher salt, 1/2 teaspoon ground black pepper"
Taqueria Style Tacos - Carne Asada,https://www.allrecipes.com/recipe/70935/taqueria-style-tacos-carne-asada/,"3 pounds flank steak, 1/3 cup white vinegar, 1/2 cup soy sauce, 4 cloves garlic; minced, 2 limes; juiced, 1/2 cup olive oil, 1 teaspoon salt, 1 teaspoon ground black pepper, 1 teaspoon ground white pepper, 1 teaspoon garlic powder, 1 teaspoon chili powder, 1 teaspoon dried oregano, 1 teaspoon ground cumin, 1 teaspoon paprika, 1 white onion; chopped, 1/2 cup chopped fresh cilantro, 1 lime; juiced, 2 large tomatoes; chopped, 2 jalapeno peppers; chopped, 1 white onion; quartered, 4 cloves garlic; peeled, 4 dried New Mexico chile pods, 1 pinch salt and pepper to taste, 1 (32 ounce) package corn tortillas, 2 cups grated cotija cheese (optional), 2 limes; cut into wedges"
Banana Nut Bread Baked in a Jar,https://www.allrecipes.com/recipe/7024/banana-nut-bread-baked-in-a-jar/,"2/3 cup shortening, 2 2/3 cups white sugar, 4 eggs, 2 cups mashed bananas, 2/3 cup water, 3 1/3 cups all-purpose flour, 1/2 teaspoon baking powder, 2 teaspoons baking soda, 1 1/2 teaspoons salt, 1 teaspoon ground cinnamon, 1 teaspoon ground cloves, 2/3 cup chopped pecans"
It's Chili by George!!,https://www.allrecipes.com/recipe/14985/its-chili-by-george/,"2 pounds lean ground beef, 1 (46 fluid ounce) can tomato juice, 1 (29 ounce) can tomato sauce, 1 (15 ounce) can kidney beans; drained and rinsed, 1 (15 ounce) can pinto beans; drained and rinsed, 1 1/2 cups chopped onion, 1/4 cup chopped green bell pepper, 1/8 teaspoon ground cayenne pepper, 1/2 teaspoon white sugar, 1/2 teaspoon dried oregano, 1/2 teaspoon ground black pepper, 1 teaspoon salt, 1 1/2 teaspoons ground cumin, 1/4 cup chili powder"
Traditional Filipino Lumpia,https://www.allrecipes.com/recipe/35151/traditional-filipino-lumpia/,"1 tablespoon vegetable oil, 1 pound ground pork, 2 cloves garlic; crushed, ½ cup chopped onion, ½ cup minced carrots, ½ cup chopped green onions, ½ cup thinly sliced green cabbage, 1 teaspoon ground black pepper, 1 teaspoon salt, 1 teaspoon garlic powder, 1 teaspoon soy sauce, 30 lumpia wrappers, 2 cups vegetable oil for frying"
Cranberry Dip,https://www.allrecipes.com/recipe/96279/cranberry-dip/,"1 (12 ounce) package fresh cranberries, 1 cup white sugar, 1 cup apricot jam, 1 cup chopped pecans, 1 (8 ounce) package cream cheese"
Creamy Coconut Cake,https://www.allrecipes.com/recipe/23762/creamy-coconut-cake/,"1 (16 ounce) package white cake mix, 1 (14 ounce) can cream of coconut, 1 (14 ounce) can sweetened condensed milk, 1 (16 ounce) container frozen whipped topping; thawed, 1 (10 ounce) package flaked coconut"
Spinach Tomato Tortellini,https://www.allrecipes.com/recipe/76129/spinach-tomato-tortellini/,"1 (16 ounce) package cheese tortellini, 1 (14.5 ounce) can diced tomatoes with garlic and onion, 1 cup chopped fresh spinach, 1/2 teaspoon salt, 1/4 teaspoon pepper, 1 1/2 teaspoons dried basil, 1 teaspoon minced garlic, 2 tablespoons all-purpose flour, 3/4 cup milk, 3/4 cup heavy cream, 1/4 cup grated Parmesan cheese"
Glazed Apple Cream Pie,https://www.allrecipes.com/recipe/13820/glazed-apple-cream-pie/,"½ cup white sugar, ½ cup milk, ½ cup heavy cream, ¼ cup butter, 2 tablespoons cornstarch, 2 tablespoons milk, 1 teaspoon vanilla extract, 2 tart apples - peeled; cored and sliced, 1 tablespoon all-purpose flour, ¼ teaspoon ground cinnamon, 1 (15 ounce) package pastry for double-crust pie, ½ cup confectioners' sugar, 1 tablespoon milk, ¼ teaspoon vanilla extract, 1 tablespoon butter; softened"
